{
  "$schema": "http://json-schema.org/draft-07/schema#",
  "title": "AlphaSpec",
  "description": "Specification for a pluggable alpha signal",
  "type": "object",
  "required": ["alpha_id", "type"],
  "properties": {
    "alpha_id": {"type": "string"},
    "version": {"type": "string", "default": "1.0.0"},
    "type": {"enum": ["expression_tree", "model"]},
    "description": {"type": "string"},
    "expression": {"type": "string"},
    "compute": {
      "type": "object",
      "properties": {
        "checkpoint": {"type": "string"},
        "input_features": {"type": "array", "items": {"type": "string"}},
        "sequence_length": {"type": "integer"}
      }
    },
    "normalization": {
      "type": "object",
      "properties": {
        "method": {"enum": ["rolling_zscore", "cross_sectional"]},
        "lookback": {"type": "integer", "minimum": 2}
      }
    },
    "validation": {"type": "object"},
    "weight_hint": {"type": "number", "minimum": 0},
    "horizon": {"type": "string"},
    "meta": {"type": "object"}
  }
}
